[
  {
    "id": "google",
    "name": "Google (Gemini)",
    "sustainability_report_url": "https://sustainability.google/reports/google-2026-environmental-report/",
    "disclosures": {
      "water_usage": {
        "status": "yes",
        "detail": "Reports total water consumption annually (10.9B gallons in 2025, up 34% from 2024), with withdrawal, discharge and consumption broken out for data centers and offices.",
        "source_url": "https://sustainability.google/reports/google-2026-environmental-report/"
      },
      "energy_usage": {
        "status": "yes",
        "detail": "Reports total energy consumption (44.0M MWh in 2025, of which 42.4M MWh data centers) and a 2025 fleet-wide average PUE of 1.09. Reports ~65% global hourly carbon-free energy in 2025.",
        "source_url": "https://sustainability.google/reports/google-2026-environmental-report/"
      },
      "per_facility_reporting": {
        "status": "yes",
        "detail": "Publishes water withdrawal, discharge and consumption for each data center location (e.g., Council Bluffs, IA: 1.35B gallons consumed in 2025) and PUE per facility.",
        "source_url": "https://sustainability.google/reports/google-2026-environmental-report/"
      },
      "ai_specific_data": {
        "status": "yes",
        "detail": "Published per-prompt estimates for the median Gemini Apps text prompt (0.24 Wh energy, 0.03 gCO2e, 0.26 ml water) with a technical methodology paper (2025); repeated in the 2026 Environmental Report.",
        "source_url": "https://cloud.google.com/blog/products/infrastructure/measuring-the-environmental-impact-of-ai-inference/"
      },
      "water_pledge": {
        "status": "yes",
        "detail": "Aims to replenish 120% of the freshwater it consumes, on average across offices and data centers, by 2030. Replenished ~7.7B gallons (~78% of freshwater consumption) in 2025.",
        "source_url": "https://sustainability.google/reports/google-2026-environmental-report/"
      }
    },
    "last_updated": "2026-10-30"
  },
  {
    "id": "microsoft",
    "name": "Microsoft (OpenAI)",
    "sustainability_report_url": "https://www.microsoft.com/en-us/corporate-responsibility/topics/sustainability/report/",
    "disclosures": {
      "water_usage": {
        "status": "yes",
        "detail": "Reports total water withdrawal (13,266 ML) and consumption (8,170 ML, up 22% year over year) for FY25 in its Environmental Data Fact Sheet. Reports a global average datacenter WUE of 0.27 L/kWh for FY25.",
        "source_url": "https://cdn-dynmedia-1.microsoft.com/is/content/microsoftcorp/microsoft/msc/documents/presentations/CSR/2026-Microsoft-Environmental-Data-Fact-Sheet-PDF.pdf"
      },
      "energy_usage": {
        "status": "yes",
        "detail": "Reports total energy consumption (37.5M MWh in FY25) and a global average datacenter PUE of 1.17 for FY25.",
        "source_url": "https://cdn-dynmedia-1.microsoft.com/is/content/microsoftcorp/microsoft/msc/documents/presentations/CSR/2026-Microsoft-Environmental-Data-Fact-Sheet-PDF.pdf"
      },
      "per_facility_reporting": {
        "status": "no",
        "detail": "Publishes datacenter PUE and WUE for three broad regions (Americas, Asia Pacific, EMEA) but not water or energy figures for individual facilities.",
        "source_url": "https://datacenters.microsoft.com/sustainability/efficiency/"
      },
      "ai_specific_data": {
        "status": "no",
        "detail": "Does not publish measured water or energy figures for its AI workloads. The FY25 report cites Microsoft research that optimized large-scale inference can use under one watt-hour per query, but gives no figures for Copilot or OpenAI workloads.",
        "source_url": "https://www.microsoft.com/en-us/corporate-responsibility/topics/sustainability/report/"
      },
      "water_pledge": {
        "status": "yes",
        "detail": "Pledged to be water positive by 2030 by reducing water use and replenishing more than it withdraws. Reports replenishing over 14.2M cubic meters in FY25, exceeding its global withdrawals.",
        "source_url": "https://www.microsoft.com/en-us/corporate-responsibility/topics/sustainability/report/"
      }
    },
    "last_updated": "2026-10-30"
  },
  {
    "id": "amazon",
    "name": "Amazon (AWS)",
    "sustainability_report_url": "https://sustainability.aboutamazon.com/",
    "disclosures": {
      "water_usage": {
        "status": "yes",
        "detail": "Reports total water withdrawal for AWS data centers (9.4B liters in 2025) and a global WUE of 0.12 L/kWh. Does not report a separate water consumption figure.",
        "source_url": "https://sustainability.aboutamazon.com/2025-aws-summary.pdf"
      },
      "energy_usage": {
        "status": "partial",
        "detail": "Reports a global AWS data center PUE of 1.14 for 2025 and that electricity consumed is matched with renewable energy. Does not report a total energy consumption figure for AWS.",
        "source_url": "https://sustainability.aboutamazon.com/2025-aws-summary.pdf"
      },
      "per_facility_reporting": {
        "status": "partial",
        "detail": "Publishes AWS fact sheets by location with water withdrawal, PUE and WUE (e.g., Virginia: 263M gallons withdrawn in 2025), but not figures for individual data centers.",
        "source_url": "https://sustainability.aboutamazon.com/aws-sustainability-fact-sheets/aws-fact-sheet-virginia.pdf"
      },
      "ai_specific_data": {
        "status": "no",
        "detail": "No published water or energy data specific to AI/ML workloads.",
        "source_url": null
      },
      "water_pledge": {
        "status": "yes",
        "detail": "Pledged that AWS will be water positive across its data centers by 2030. Reports being 75% of the way toward that goal at the end of 2025.",
        "source_url": "https://sustainability.aboutamazon.com/natural-resources/water"
      }
    },
    "last_updated": "2026-10-30"
  },
  {
    "id": "meta",
    "name": "Meta (LLaMA)",
    "sustainability_report_url": "https://sustainability.atmeta.com/2025-sustainability-report/",
    "disclosures": {
      "water_usage": {
        "status": "yes",
        "detail": "Reports total water withdrawal (5,637 ML) and consumption (3,123 ML, 2,974 ML from data centers) for 2024 in its Environmental Data Index. Reports an annual data center WUE of 0.19 L/kWh.",
        "source_url": "https://sustainability.atmeta.com/wp-content/uploads/2025/10/Meta_2025-Environmental-Data-Index.pdf"
      },
      "energy_usage": {
        "status": "yes",
        "detail": "Reports total electricity consumption (18.4M MWh in 2024) and a data center PUE of 1.08 in its Environmental Data Index.",
        "source_url": "https://sustainability.atmeta.com/wp-content/uploads/2025/10/Meta_2025-Environmental-Data-Index.pdf"
      },
      "per_facility_reporting": {
        "status": "yes",
        "detail": "Publishes water withdrawal and electricity consumption for each data center (e.g., Prineville, OR: 328 ML withdrawn and 1.73M MWh consumed in 2024).",
        "source_url": "https://sustainability.atmeta.com/wp-content/uploads/2025/10/Meta_2025-Environmental-Data-Index.pdf"
      },
      "ai_specific_data": {
        "status": "partial",
        "detail": "Llama model cards report training GPU hours, per-GPU power and estimated training emissions (e.g., Llama 4: 7.38M GPU hours). No water data and no inference energy data published.",
        "source_url": "https://github.com/meta-llama/llama-models/blob/main/models/llama4/MODEL_CARD.md"
      },
      "water_pledge": {
        "status": "yes",
        "detail": "Set a goal to become water positive in 2030, restoring 200% of water consumed in high water stress regions and 100% in medium water stress regions. Reports restoring over 1.6B gallons in 2024.",
        "source_url": "https://sustainability.atmeta.com/water/"
      }
    },
    "last_updated": "2026-10-30"
  },
  {
    "id": "anthropic",
    "name": "Anthropic (Claude)",
    "sustainability_report_url": null,
    "disclosures": {
      "water_usage": {
        "status": "no",
        "detail": "No sustainability report or water usage data published as of October 2026.",
        "source_url": null
      },
      "energy_usage": {
        "status": "no",
        "detail": "No energy consumption data published. Relies on AWS and Google Cloud infrastructure.",
        "source_url": "https://www.anthropic.com/news/expanding-our-use-of-google-cloud-tpus-and-services"
      },
      "per_facility_reporting": {
        "status": "no",
        "detail": "Not applicable — Anthropic does not operate its own data centers.",
        "source_url": null
      },
      "ai_specific_data": {
        "status": "no",
        "detail": "No per-model or per-query energy or water data published.",
        "source_url": null
      },
      "water_pledge": {
        "status": "no",
        "detail": "No water-related sustainability commitments published.",
        "source_url": null
      }
    },
    "last_updated": "2026-10-30"
  },
  {
    "id": "perplexity",
    "name": "Perplexity",
    "sustainability_report_url": null,
    "disclosures": {
      "water_usage": {
        "status": "no",
        "detail": "No sustainability report or water usage data published as of October 2026.",
        "source_url": null
      },
      "energy_usage": {
        "status": "no",
        "detail": "No energy consumption data published. Relies on third-party cloud infrastructure (AWS, Azure, CoreWeave).",
        "source_url": "https://aws.amazon.com/solutions/case-studies/perplexity-bedrock-case-study/"
      },
      "per_facility_reporting": {
        "status": "no",
        "detail": "Not applicable — Perplexity does not operate its own data centers.",
        "source_url": null
      },
      "ai_specific_data": {
        "status": "no",
        "detail": "No per-query energy or water data published.",
        "source_url": null